Verse	Polarity	Emotion	Intensity	Text	Context
Psalm 70:0	Neutral	Anticipation	Moderate	For the choirmaster. Of David. To bring to remembrance.	This is an introduction and it indicates that the Psalm is meant for the choirmaster and it is by David, intended for bringing something to remembrance.
Psalm 70:1	Negative	Desperation	High	Make haste, O God, to deliver me; O LORD, make haste to help me.	The psalmist is in urgent need of deliverance and is calling upon God for immediate help.
Psalm 70:2	Negative	Anguish	Moderate	May those who seek my life be put to shame and confounded; may all who desire my harm be turned back and humiliated.	The psalmist wishes that those who seek his harm would be shamed and thwarted in their plans.
Psalm 70:3	Negative	Contempt	Moderate	May those who say, "Aha, aha!" turn back in their own shame.	The psalmist is expressing a desire for those who mock and revel in his troubles to be embarrassed and defeated.
Psalm 70:4	Positive	Joy	Moderate	May all who seek You rejoice and be glad in You; may those who love Your salvation always say, "God is great!"	Amidst the psalmist's troubles, there is a call for those who seek God and cherish His salvation to be joyful and to exclaim God's greatness.
Psalm 70:5	Negative	Need	High	Yet I am poor and needy; hurry to me, O God. You are my help and my deliverer; O LORD, do not delay.	The psalmist acknowledges his vulnerable state and reiterates his urgent plea for God's assistance, affirming his dependence on God's timely intervention.