Verse	Polarity	Emotion	Intensity	Text	Context
Psalm 101:1	Positive	Joy	Medium	I will sing of lovingkindness and justice; to You, O LORD, I will sing praises.	David commits to praising God, focusing on His attributes of lovingkindness and justice.
Psalm 101:2	Positive	Resolve	High	I will ponder the way of integrity. Oh when will You come to me? I will walk in my house with integrity of heart.	David expresses his determination to live a life of integrity and eagerly longs for God's presence.
Psalm 101:3	Negative	Aversion	High	I will set no worthless thing before my eyes. I hate the work of those who fall away; it shall not cling to me.	David makes a personal vow to avoid evil influences and expresses his hate for the deeds of the unfaithful.
Psalm 101:4	Negative	Disgust	Medium	A perverse heart shall be far from me; I will know nothing of evil.	David resolves to distance himself from corruption and to remain ignorant of evil plots.
Psalm 101:5	Negative	Anger	High	W whoever slanders his neighbor in secret, him will I destroy; he who has a haughty look and an arrogant heart will not endure.	David speaks of his zero-tolerance policy for slander and pride in the context of governing justly.
Psalm 101:6	Positive	Approval	Medium	My eyes will be on the faithful of the land, that they may dwell with me; he whose walk is blameless will minister to me.	David seeks out the faithful and blameless as companions and servants, reflecting his commitment to righteousness.
Psalm 101:7	Negative	Rejection	High	No one who practices deceit shall dwell in my house; no one who tells lies shall stand in my presence.	David declares his household will be free of deceit and lies, emphasizing the importance of truthfulness.
Psalm 101:8	Positive	Determination	High	Every morning I will put to silence all the wicked in the land, I will cut off every evildoer from the city of the LORD.	David reaffirms his daily commitment to oppose the wicked and purge evil from the land as part of his duty to uphold God's laws.