Verse	Polarity	Emotion	Intensity	Text	Context
Psalm 13:1	Negative	Anguish	Low	How long, O LORD? Will You forget me forever? How long will You hide Your face from me?	David is feeling abandoned and is questioning God's presence in his time of distress.
Psalm 13:1	Negative	Frustration	Medium	How long must I wrestle with my thoughts, and every day have sorrow in my heart? How long will my enemy triumph over me?	David is expressing frustration and sorrow, indicating an ongoing battle with his own thoughts and perceived victories of his enemies.
Psalm 13:2	Negative	Desperation	High	Look on me and answer, O LORD my God. Give light to my eyes, or I will sleep in death.	David pleads for God's attention and help, fearing death or defeat without God's intervention.
Psalm 13:3	Positive	Hope	Medium	And my enemy will say, "I have overcome him," and my foes will rejoice when I fall.	David is concerned about his enemies boasting of their victory which would happen if God does not intervene.
Psalm 13:4	Positive	Trust	Low	But I have trusted in Your loving devotion; my heart rejoices in Your salvation.	David reaffirms his trust in God and finds joy in his salvation despite the circumstances.
Psalm 13:5	Positive	Joy	High	I will sing to the LORD, for He has been good to me.	David ends the Psalm with a note of thanksgiving and worship, reflecting his trust in God's goodness and faithfulness.