Verse	Polarity	Emotion	Intensity	Text	Context
Psalm 27:1	Positive	Confidence	High	The LORD is my light and my salvation—whom shall I fear? The LORD is the stronghold of my life—of whom shall I be afraid?	David expresses his complete trust in the LORD, portraying Him as his light, salvation, and fortress.
Psalm 27:2	Negative	Anger	Medium	When evildoers came against me to devour my flesh, my foes and my enemies stumbled and fell.	David recounts his enemies’ aggression and their ultimate downfall, implying God‘s protection over him.
Psalm 27:3	Positive	Confidence	High	Though an army encamps around me, my heart will not fear; though a war breaks out against me, even then will I be confident.	David speaks of remaining fearless and confident despite being surrounded by threats and conflict.
Psalm 27:4	Positive	Longing	Medium	One thing I have asked of the LORD; this is what I desire: to dwell in the house of the LORD all the days of my life, to gaze on the beauty of the LORD and seek Him in His temple.	David expresses a singular, earnest desire to be in God’s presence continually.
Psalm 27:5	Positive	Relief	High	For in the day of trouble He will hide me in His shelter; He will conceal me under the cover of His tent; He will set me high upon a rock.	David conveys his assurance that God will protect and elevate him above his troubles.
Psalm 27:6	Positive	Joy	High	Then my head will be exalted above the enemies who surround me; at His tabernacle I will offer sacrifices with shouts of joy; I will sing and make music to the LORD.	David anticipates victory and worshipful celebration in the presence of God.
Psalm 27:7	Negative	Desperation	Medium	Hear, O LORD, when I cry aloud; be gracious to me and answer me.	David implores God to listen and respond to him with graciousness, indicating a moment of earnest seeking.
Psalm 27:8	Positive	Longing	Medium	To You my heart says, ”Seek His face.“ Your face, LORD, I will seek.	David resolves to seek God‘s presence in response to an inward prompting.
Psalm 27:9	Negative	Fear	Medium	Do not hide Your face from me, do not turn Your servant away in anger; You have been my helper. Do not reject me or forsake me, O God my Savior.	David expresses fear of abandonment and pleads for God’s continual presence and help.
Psalm 27:10	Positive	Confidence	High	Though my father and mother forsake me, the LORD will receive me.	David declares his confidence that, even if his closest relations abandon him, the LORD will not.
Psalm 27:11	Positive	Supplication	Medium	Teach me Your way, O LORD, and lead me on a level path, because of my oppressors.	David seeks guidance and a smooth path from the LORD, possibly to avoid pitfalls set by his enemies.
Psalm 27:12	Negative	Anxiety	Medium	Do not hand me over to the will of my foes, for false witnesses rise up against me, breathing out violence.	David articulates concern over his adversaries‘ desires and false testimony against him.
Psalm 27:13	Positive	Hope	High	I am still confident of this: I will see the goodness of the LORD in the land of the living.	David affirms a hope that goes beyond his present troubles; he believes he will witness God’s goodness in his lifetime.
Psalm 27:14	Positive	Encouragement	High	Wait for the LORD; be strong and take heart and wait for the LORD.	David concludes with advice to remain patient and courageous while waiting for the LORD‘s intervention.