Verse	Polarity	Emotion	Intensity	Text	Context
Psalm 127:1	Neutral	Calm	Low	Unless the LORD builds the house, its builders labor in vain. Unless the LORD watches over the city, the watchman stays alert in vain.	This verse emphasizes the futility of human efforts without divine blessing. It metaphorically compares the building of a house and guarding a city to any human endeavor.
Psalm 127:2	Negative	Tiredness	Low	In vain you rise early and stay up late, toiling for food to eat—for He grants sleep to those He loves.	Expresses the pointlessness of anxious labor and the value of rest, illustrating that provision and rest come from God.
Psalm 127:3	Positive	Joy	Medium	Children are a heritage from the LORD, offspring a reward from Him.	This verse shifts to express the blessing and value of children, indicating a positive view of family as bestowed by God.
Psalm 127:4	Positive	Assurance	Low	Like arrows in the hand of a warrior, so are children born in one’s youth.	Emphasizes the strength and potential that children bring to their parents, comparing them to a warrior‘s arrows.
Psalm 127:5	Positive	Contentment	Medium	Blessed is the man whose quiver is full of them. They will not be put to shame when they contend with their opponents in court.	Ends on a positive note about the blessings of having a family; suggests security and honor in society.