Verse	Polarity	Emotion	Intensity	Text	Context
Psalm 14:1	Negative	Disdain	Medium	The fool says in his heart, “There is no God.” They are corrupt; their acts are vile. There is no one who does good.	David speaks of the moral corruption that comes from denying God’s existence, emphasizing the depravity of such a stance.
Psalm 14:2	Neutral	Observation	Low	The LORD looks down from heaven upon the children of men to see if there are any who understand, any who seek God.	This describes God observing humanity, searching for righteousness or wisdom among people.
Psalm 14:3	Negative	Despair	Medium	All have turned away, they have together become corrupt; there is no one who does good, not even one.	David laments the universal sinfulness of mankind, observing a complete lack of goodness.
Psalm 14:4	Negative	Accusation	Medium	Will the workers of iniquity never learn? They devour my people like bread; they do not call upon the LORD.	This is both an accusation against and a question regarding the wicked, who harm the faithful yet do not seek the Lord.
Psalm 14:5	Negative	Fear	High	There they are, overwhelmed with dread, for God is present in the company of the righteous.	The verse depicts the wicked in fear, as they suddenly realize God’s presence protects the righteous.
Psalm 14:6	Negative	Scorn	Medium	You evildoers frustrate the plans of the poor, but the LORD is their refuge.	This points to the wicked undermining the poor, but affirms that God is a safe haven for the downtrodden.
Psalm 14:7	Positive	Hope	High	Oh, that salvation for Israel would come out of Zion! When the LORD restores His people, let Jacob rejoice and Israel be glad!	This is a cry for deliverance and a prophetic anticipation of Israel’s restoration, leading to joy and celebration.
