Verse	Polarity	Emotion	Intensity	Text	Context
Psalm 20:1	Positive	Trust/Mild	May the LORD answer you in the day of trouble; may the name of the God of Jacob protect you.	This verse expresses a blessing and a prayer of protection for the reader, often used in times of difficulty.
Psalm 20:2	Positive	Hope/Mild	May He send you help from the sanctuary and sustain you from Zion.	The verse continues the blessing, with hope that God will provide help and support.
Psalm 20:3	Neutral	Observation	Low	May He remember all your offerings and accept your burnt sacrifice. Selah	This verse speaks about the religious offerings of the reader, petitioning God to remember and accept them favorably.
Psalm 20:4	Positive	Wish/Desire	Medium	May He give you the desire of your heart and make all your plans succeed.	It is a blessing that expresses a desire for the personal aspirations and accomplishments of the reader to be fulfilled.
Psalm 20:5	Positive	Joy/High	We will shout for joy when you are victorious and will lift up our banners in the name of our God. May the LORD grant all your requests.	The verse shifts from blessing to declaration of collective celebration upon the reader's success, suggesting community support for the individual's endeavors.
Psalm 20:6	Positive	Confidence/Medium	Now I know that the LORD saves His anointed; He answers him from His holy heaven with the saving power of His right hand.	Expresses strong confidence in God's salvation and help for the chosen individual, highlighting God's ability to answer prayers.
Psalm 20:7	Positive	Trust/Medium	Some trust in chariots and others in horses, but we trust in the name of the LORD our God.	This verse contrasts the readers' faith in God with the worldly trust in military might and human resources.
Psalm 20:8	Positive	Reflection/Mild	They collapse and fall, but we rise up and stand firm.	It reflects on the failure of those who trust in their own might versus the stability of those who trust in God.
Psalm 20:9	Positive	Prayer/Desire	High	O LORD, save the king. Answer us when we call!	It is a direct plea for God's intervention on behalf of the king or leader, asking for God's response to their prayers.
