Verse	Polarity	Emotion	Intensity	Text	Context
Psalm 145:1	Positive	Praise	High	I will exalt You, my God the King; I will bless Your name forever and ever.	David commits to praising God as a personal act of worship.
Psalm 145:2	Positive	Praise	High	Every day I will bless You, and I will praise Your name forever and ever.	David intends to make praise a daily practice, indicating continual, devoted worship.
Psalm 145:3	Positive	Admiration	High	Great is the LORD, and greatly to be praised; His greatness is unsearchable.	David acknowledges God's greatness as beyond human understanding.
Psalm 145:4	Positive	Reflection	Medium	One generation will commend Your works to another; they will tell of Your mighty acts.	David speaks of the importance of passing down the knowledge of God's works from one generation to the next.
Psalm 145:5	Positive	Contemplation	Medium	I will meditate on the glorious splendor of Your majesty and on Your wondrous works.	David expresses his personal commitment to reflect on the glory and wonders of God.
Psalm 145:6	Positive	Praise	High	Men will speak of the power of Your awesome works, and I will proclaim Your greatness.	David anticipates that people will talk about God's acts, and he adds his personal declaration to that testimony.
Psalm 145:7	Positive	Praise	High	They will pour forth the fame of Your abundant goodness and will sing of Your righteousness.	There is an expectation of overflowing praise from others, echoing the goodness and righteousness of God.
Psalm 145:8	Positive	Admiration	Medium	The LORD is gracious and compassionate, slow to anger and rich in loving devotion.	David reflects on God's character, emphasizing His grace, compassion, patience, and steadfast love.
Psalm 145:9	Positive	Praise	High	The LORD is good to all; His compassion rests on all He has made.	David proclaims God’s universal goodness and care for His creation.
Psalm 145:10	Positive	Praise	Medium	All You have made will give You thanks, O LORD, and Your saints will bless You.	David envisions all of creation as well as the faithful giving thanks to God.
Psalm 145:11	Positive	Declaration	Medium	They will tell of the glory of Your kingdom and speak of Your might,	The focus is on God's kingdom and might, suggesting a declaration of His sovereign rule and power.
Psalm 145:12	Positive	Proclamation	Medium	so that all men may know of Your mighty acts and the glorious splendor of Your kingdom.	The purpose of this proclamation is evangelistic, intending that all people hear of God's acts and majestic reign.
Psalm 145:13	Positive	Affirmation	High	Your kingdom is an everlasting kingdom, and Your dominion endures through all generations.	The LORD is faithful in all His words and gracious in all His actions.	Here, David affirms the eternal nature of God's kingdom and His faithfulness across all time.
Psalm 145:14	Positive	Support	Medium	The LORD upholds all who fall and lifts up all who are bowed down.	David speaks to God's character as a sustainer and encourager of those in need.
Psalm 145:15	Positive	Anticipation	Medium	The eyes of all look to You, and You give them their food in due time.	David points to God as the provider for all creatures, acknowledging His timing in meeting needs.
Psalm 145:16	Positive	Provision	High	You open Your hand and satisfy the desire of every living thing.	This verse conveys the idea of God as a generous provider who meets the needs of all.
Psalm 145:17	Positive	Righteousness	Medium	The LORD is righteous in all His ways and kind in all His works.	David declares the goodness and kindness of God's nature, seen in all His works.
Psalm 145:18	Positive	Presence	Medium	The LORD is near to all who call on Him, to all who call on Him in truth.	There is a promise of God's presence for those who sincerely reach out to Him.
Psalm 145:19	Positive	Provision	Medium	He fulfills the desires of those who fear Him; He hears their cry and saves them.	David expresses confidence in God listening and responding to those who revere Him.
Psalm 145:20	Positive	Preservation	Medium	The LORD preserves all who love Him, but all the wicked He will destroy.	Contrast is made between God’s protective love for the righteous and the eventual judgment of the wicked.
Psalm 145:21	Positive	Praise	High	My mouth will declare the praise of the LORD; let every creature bless His holy name forever and ever.	David commits personally to perpetual praise and invites all of creation to join in exalting God.

