Verse	Polarity	Emotion	Intensity	Text	Context
Psalm 56:0	Positive	Trust	Moderate	To the choirmaster. According to The Dove on Far-off Terebinths. A Miktam of David, when the Philistines seized him in Gath.	This title gives context to the emotional background of the Psalm, indicating a situation where David was under duress by his enemies.
Psalm 56:1	Negative	Fear	High	Be gracious to me, O God, for man has trampled me; all day long he oppresses me.	The verse expresses David's plea for God’s mercy in a time of oppression by his enemies.
Psalm 56:2	Negative	Fear	High	My foes trample me all day long, for many proudly attack me.	The intensity of David's plight is highlighted by the constant trampling and proud attacks by his many foes.
Psalm 56:3	Positive	Trust	High	When I am afraid, I put my trust in You.	In the face of fear, David declares his trust in God, providing a contrasting emotional response to his fear.
Psalm 56:4	Positive	Trust	High	In God, whose word I praise, in God I trust; I will not fear. What can man do to me?	David affirms his trust in God and questions the power of man compared to God's, emphasizing his choice not to fear.
Psalm 56:5	Negative	Anger	Moderate	All day long they twist my words; all their thoughts are against me for evil.	David describes the deceit and hostile intentions of his enemies, which fuels his sense of injustice.
Psalm 56:6	Negative	Anger	High	They stir up strife, they lie in wait; they spy on my footsteps, eager to take my life.	The verse depicts the extreme actions of his enemies, who are conspiring and actively seeking to harm David.
Psalm 56:7	Negative	Anger	Moderate	By iniquity they escape; in your anger cast down the peoples, O God!	David calls for God’s judgement on the peoples who have wronged him, expressing his desire for divine retribution.
Psalm 56:8	Positive	Consolation	Moderate	You have kept count of my tossings; put my tears in Your bottle. Are they not in Your book?	David takes solace in the fact that God is aware of his suffering and has recorded all his tears and tribulations.
Psalm 56:9	Positive	Trust	High	Then my enemies will retreat on the day I call for help. By this I will know that God is for me.	David expresses confidence that his enemies will be defeated when he calls on God, affirming his belief in God's support.
Psalm 56:10	Positive	Trust	High	In God, whose word I praise, in the LORD, whose word I praise,	David's trust in God is reinforced by his praise of God's word.
Psalm 56:11	Positive	Trust	High	in God I trust; I will not be afraid. What can man do to me?	David reasserts his trust in God and his refusal to fear, questioning again the power of man over God's protection.
Psalm 56:12	Positive	Gratitude	Moderate	I am bound by vows to You, O God; I will render thank offerings to You.	David acknowledges his obligations and gratitude to God, promising to bring offerings in thanksgiving.
Psalm 56:13	Positive	Gratitude	High	For You have delivered my soul from death, and my feet from stumbling, that I may walk before God in the light of life.	David ends the Psalm with an expression of deep gratitude for God's deliverance from death and enabling him to live a godly life.