Verse	Polarity	Emotion	Intensity	Text	Context
Psalm 3:1	Negative	Fear	Medium	O LORD, how my foes have increased! How many rise up against me!	David expresses distress over the number of his enemies.
Psalm 3:2	Negative	Despair	Medium	Many say of me, ”God will not deliver him.“ Selah	David relays the words of his doubters who believe God will not save him.
Psalm 3:3	Positive	Confidence	High	But You, O LORD, are a shield around me, my glory, and the One who lifts my head.	David affirms his confidence in God as his protector and the source of his honor.
Psalm 3:4	Positive	Gratitude	High	To the LORD I cry aloud, and He answers me from His holy hill. Selah	David recalls crying out to God and receiving a response, illustrating his close relationship with God.
Psalm 3:5	Positive	Peace	Medium	I lie down and sleep; I wake again, for the LORD sustains me.	Expressing trust in God, David explains that he can rest peacefully because of God’s support.
Psalm 3:6	Positive	Courage	High	I will not fear the tens of thousands drawn up against me on every side.	David‘s faith gives him courage despite being outnumbered by his enemies.
Psalm 3:7	Positive	Assertiveness	High	Arise, O LORD! Save me, O my God! For You strike all my enemies on the cheek; You shatter the teeth of the wicked.	David calls upon God to act and asserts his belief in God’s power to defeat his enemies.
Psalm 3:8	Positive	Trust	High	Salvation belongs to the LORD; Your blessing is on Your people. Selah	David concludes with a statement of faith that God owns salvation and blesses His people, offering a final reflection.

